{
  "_id": "2026-05-20-telling-your-brand-story-better-src",
  "tenantId": "toc",
  "kind": "document",
  "captureMode": "provided",
  "path": "raw/TOC/TOC-Materials/Transcripts/20th-May-Telling-Your-Brand-Story-Better.content.md",
  "hash": "869ec7f252f3f2f9bddb8898e15035c0a5656eb61e8ce86115a2bebc40df0f5c",
  "consent": {
    "given": true,
    "recordedBy": "The Outreach Collective (TOC)",
    "note": "transcript provided by TOC, not captured by Vidysea"
  },
  "createdAt": "2026-09-03T06:13:39.471Z"
}