{
  "_id": "2026-06-19-entrance-exams-pathways-india-part1-src",
  "tenantId": "toc",
  "kind": "document",
  "captureMode": "provided",
  "path": "raw/TOC/TOC-Materials/Transcripts/19th-June-Entrance-Exams-Pathways-India-Part1.content.md",
  "hash": "b8b2d60db4232eb325a2d1365c35424093768576a44bfac4d4f4d11102c2e9ac",
  "consent": {
    "given": true,
    "recordedBy": "The Outreach Collective (TOC)",
    "note": "transcript provided by TOC, not captured by Vidysea"
  },
  "createdAt": "2026-09-03T06:13:39.468Z"
}