{
  "_id": "2026-08-10-ucas-what-changed-what-matters-src",
  "tenantId": "toc",
  "kind": "document",
  "captureMode": "provided",
  "path": "raw/TOC/TOC-Materials/Transcripts/10th-August-What-Changed-What-Matters-–-Inside-the-New-UCAS-Application-.content.md",
  "hash": "f45f062f3dcac4f9a19c1c63f84404513802b2ecd06280f97d1c5d8c69145423",
  "consent": {
    "given": true,
    "recordedBy": "The Outreach Collective (TOC)",
    "note": "transcript provided by TOC, not captured by Vidysea"
  },
  "createdAt": "2026-09-03T06:13:39.454Z"
}