{
  "_id": "2026-07-15-creative-futures-src",
  "tenantId": "toc",
  "kind": "document",
  "captureMode": "provided",
  "path": "raw/TOC/TOC-Materials/Transcripts/15th-July-Creative-Futures.content.md",
  "hash": "228431ee3c39a1556755c6e5feb63978bc5a6600f54f324ed4660dfc75101d89",
  "consent": {
    "given": true,
    "recordedBy": "The Outreach Collective (TOC)",
    "note": "transcript provided by TOC, not captured by Vidysea"
  },
  "createdAt": "2026-09-03T06:13:39.464Z"
}