{
  "_id": "2026-07-08-beyond-black-robes-law-careers-src",
  "tenantId": "toc",
  "kind": "document",
  "captureMode": "provided",
  "path": "raw/TOC/TOC-Materials/Transcripts/8th-July-Beyond-Black-Robes-Law-Careers.content.md",
  "hash": "9c01fe4cb898f66de2d0603d69220cb23617740ff6835b3ff8d1e4a5bc48df3c",
  "consent": {
    "given": true,
    "recordedBy": "The Outreach Collective (TOC)",
    "note": "transcript provided by TOC, not captured by Vidysea"
  },
  "createdAt": "2026-09-03T06:13:39.516Z"
}