{
  "_id": "2026-05-29-decoding-ever-expanding-cast-src",
  "tenantId": "toc",
  "kind": "document",
  "captureMode": "provided",
  "path": "raw/TOC/TOC-Materials/Transcripts/29th-May-Decoding-Ever-Expanding-Cast.content.md",
  "hash": "6060f616bccd24df86d77ec1b3a23fd24d6972467d5e5d85e2c5444e08790695",
  "consent": {
    "given": true,
    "recordedBy": "The Outreach Collective (TOC)",
    "note": "transcript provided by TOC, not captured by Vidysea"
  },
  "createdAt": "2026-09-03T06:13:39.500Z"
}