{
  "_id": "2026-05-08-funding-dreams-loans-forex-src",
  "tenantId": "toc",
  "kind": "document",
  "captureMode": "provided",
  "path": "raw/TOC/TOC-Materials/Transcripts/8th-May-Funding-Dreams-Loans-Forex.content.md",
  "hash": "90a41cd8ac050f68455bc59aea2a06070a95f04f340870e6596548a0bb01b128",
  "consent": {
    "given": true,
    "recordedBy": "The Outreach Collective (TOC)",
    "note": "transcript provided by TOC, not captured by Vidysea"
  },
  "createdAt": "2026-09-03T06:13:39.520Z"
}