{
  "_id": "2026-08-12-uniaccess-ashoka-university-src",
  "tenantId": "toc",
  "kind": "document",
  "captureMode": "provided",
  "path": "raw/TOC/TOC-Materials/Transcripts/12th-August-UniAccess-Live-Meet-Ashoka-University.content.md",
  "hash": "65734c6015a828bf22dff0cffc291e954fafffdfd0bda204282f39f59013ce39",
  "consent": {
    "given": true,
    "recordedBy": "The Outreach Collective (TOC)",
    "note": "transcript provided by TOC, not captured by Vidysea"
  },
  "createdAt": "2026-09-03T06:13:39.458Z"
}